Influencer ID,Post URL,Post Caption,Likes,Comments,Shares,Saves,Views,Impressions,Reach,Post Image URL
588804,https://www.tiktok.com/@thoy_toy/video/7602990844706032904,"ไม่ได้อวยนะ แต่วิ่งเสร็จแล้วดื่ม ""ชเวปส์""ไชน์มัสแคทพีช โซดาน้ำตาล0% คือชอบจริง 💯
ใครกำลังหาความสดชื่นหลังออกกำลังกาย ลองดู 👀🥤#Sc#SchweppesShineMuscatPeachร#อร่อยไชน์แสงออกปากchweppesZeroSugar #SchweppesTH",32,4,3,,361,,,
3364796,https://www.tiktok.com/@daybuild/video/7603698026711960849?_r=1&_t=ZS-9432wT2CtN4,"เปิดตำนาน Godzilla -1 (Godzilla Minus one) เสียงคำรามที่ทรมาณที่สุดในโลก #godzilla #S#SchweppesShineMuscatPeach#อ#อร่อยไชน์แสงออกปากS#SchweppesZeroSugarSchweppesTH
เปิดตำนาน Godzilla: ก้าวสู่โลกใหม่จิตวิญญาณอสูร
สำรวจตำนาน Godzilla ใน Godzilla Minus One พร้อมเสียงคำรามที่ทรมานที่สุดในโลก! #ก็อตซิลล่า #gojira #godzillaminusone #movie #netflix
Keywords: Godzilla Minus One, Godzilla ตำนาน, เสียงคำรามของ Godzilla, ก็อตซิลล่า ภาพยนตร์ใหม่, Gojira 2023, ก็อตซิลล่า Netflix, จีโอจิราคู่ต่อสู้, ภาพยนตร์สยองขวัญการ์ตูน, อสูรร้ายในภาพยนตร์, เปิดตำนานก็อตซิลล่า",80,2,7,,2041,,,